{
  "$schema": "https://json-schema.org/draft/2020-12/schema",
  "$id": "https://github.com/LemonCANDY42/market-impact-agent/schemas/backtest-request.schema.json",
  "title": "Market Impact Backtest Request",
  "type": "object",
  "additionalProperties": false,
  "required": [
    "schema_version", "request_id", "signal", "as_of", "start_at", "end_at",
    "market", "instrument_ids", "data_snapshot_id", "target_selection_ref",
    "strategy_ref", "horizons_sessions", "simulation"
  ],
  "properties": {
    "schema_version": {"const": "market-impact.backtest-request.v1"},
    "request_id": {"type": "string", "minLength": 1},
    "signal": {
      "type": "object",
      "additionalProperties": false,
      "required": [
        "schema_version", "signal_id", "event_id", "instrument_id", "side", "valid_from",
        "expires_at", "evidence_refs", "invalidation_conditions"
      ],
      "properties": {
        "schema_version": {"const": "market-impact.signal-intent.v1"},
        "signal_id": {"type": "string", "minLength": 1},
        "event_id": {"type": "string", "minLength": 1},
        "instrument_id": {"type": "string", "minLength": 1},
        "side": {"enum": ["buy", "sell"]},
        "valid_from": {"type": "string", "format": "date-time"},
        "expires_at": {"type": "string", "format": "date-time"},
        "evidence_refs": {
          "type": "array", "minItems": 1, "uniqueItems": true,
          "items": {"type": "string", "minLength": 1}
        },
        "invalidation_conditions": {
          "type": "array", "minItems": 1, "uniqueItems": true,
          "items": {"type": "string", "minLength": 1}
        }
      }
    },
    "as_of": {"type": "string", "format": "date-time"},
    "start_at": {"type": "string", "format": "date-time"},
    "end_at": {"type": "string", "format": "date-time"},
    "market": {"type": "string", "minLength": 1},
    "instrument_ids": {
      "type": "array", "minItems": 1, "uniqueItems": true,
      "items": {"type": "string", "minLength": 1}
    },
    "data_snapshot_id": {"type": "string", "minLength": 1},
    "target_selection_ref": {"type": "string", "minLength": 1},
    "strategy_ref": {"type": "string", "minLength": 1},
    "horizons_sessions": {
      "type": "array", "minItems": 1, "uniqueItems": true,
      "items": {"type": "integer", "minimum": 1}
    },
    "simulation": {
      "type": "object",
      "additionalProperties": false,
      "required": [
        "data_granularity", "book_type", "fill_model", "fee_model", "venue_ruleset",
        "base_currency", "starting_cash", "random_seed"
      ],
      "properties": {
        "data_granularity": {"type": "string", "minLength": 1},
        "book_type": {"type": "string", "minLength": 1},
        "fill_model": {"type": "string", "minLength": 1},
        "fee_model": {"type": "string", "minLength": 1},
        "venue_ruleset": {"type": "string", "minLength": 1},
        "base_currency": {"type": "string", "minLength": 1},
        "starting_cash": {"type": "string", "pattern": "^(?:[1-9][0-9]*(?:\\.[0-9]*[1-9])?|0\\.[0-9]*[1-9])$"},
        "random_seed": {"type": "integer", "minimum": 0}
      }
    }
  }
}
