{
  "schema_version": "market-impact.backtest-request.v1",
  "request_id": "abqaiq-601857-recovery-state-one-session-v1",
  "signal": {
    "schema_version": "market-impact.signal-intent.v1",
    "signal_id": "opened-development-abqaiq-601857-recovery-state-v1",
    "event_id": "abqaiq-khurais-attack-2019",
    "instrument_id": "601857.XSHG",
    "side": "buy",
    "valid_from": "2019-09-18T23:59:59Z",
    "expires_at": "2019-09-20T01:30:00Z",
    "evidence_refs": [
      "aramco-attack-confirmation",
      "aramco-recovery-update",
      "aramco-shipment-update",
      "petrochina-pre-event-exposure"
    ],
    "invalidation_conditions": [
      "restored production and inventories remove the prompt crude shortfall",
      "the integrated target's downstream or policy offsets dominate its upstream exposure"
    ]
  },
  "as_of": "2019-09-18T23:59:59Z",
  "start_at": "2019-09-19T01:30:00Z",
  "end_at": "2019-09-20T07:00:00Z",
  "market": "CN",
  "instrument_ids": ["601857.XSHG"],
  "data_snapshot_id": "tushare-601857-sh-20190912-20190920-e2126de844d3c24d",
  "target_selection_ref": "opened-development-integrated-upstream:601857.v1",
  "strategy_ref": "event-impact-hold.v1",
  "horizons_sessions": [1],
  "simulation": {
    "data_granularity": "tushare_unadjusted_daily_with_source_limits.v2",
    "book_type": "modeled_open_one_lot.v1",
    "fill_model": "modeled_open_one_lot_no_slippage.v1",
    "fee_model": "xshg_2019_fee_assumption.v1",
    "venue_ruleset": "xshg_main_board_source_limit.v2",
    "base_currency": "CNY",
    "starting_cash": "1000000",
    "random_seed": 0
  }
}
